{
  "kind": "guild.skill_contract",
  "version": "1.0.0",
  "contract_id": "urn:guild:contract:local-log-analyzer:v1",
  "component": {
    "name": "local-log-analyzer",
    "digest": {
      "algorithm": "sha256",
      "value": "3e1e8cd5b8c777384ebadbcbff998788fada07c783ba361a4221fdf0f7d9c940"
    },
    "component_model": "wasm-component",
    "component_model_version": "0.2.0",
    "wit_world": "analyzer"
  },
  "export": {
    "name": "analyze_logs",
    "interface": "analyzer/logs",
    "version": "1.0.0"
  },
  "input_class_fingerprint": {
    "kind": "json-schema-hash",
    "canonicalization": "rfc8785-jcs",
    "digest": {
      "algorithm": "sha256",
      "value": "e0fa022083b39a26884d1c48b2239f7a2fbfdef89798eb5b0df7b22762546090"
    }
  },
  "required_effects": [
    {
      "effect_class": "fs.read",
      "scope": {
        "kind": "filesystem",
        "paths": [
          "/workspace/input/**"
        ],
        "symlink_policy": "deny",
        "follow_mounts": false
      },
      "cardinality": {
        "max_calls": 1000,
        "max_bytes": 1073741824
      },
      "justification": "Read input logs"
    },
    {
      "effect_class": "clock.read",
      "scope": {
        "kind": "system"
      },
      "cardinality": {
        "max_calls": 10
      },
      "justification": "Bound report timestamps"
    }
  ],
  "forbidden_effects": [
    {
      "effect_class": "fs.write",
      "scope": {
        "kind": "filesystem",
        "paths": [
          "/**"
        ],
        "symlink_policy": "deny",
        "follow_mounts": false
      },
      "justification": "Read-only analyzer"
    },
    {
      "effect_class": "net.connect",
      "scope": {
        "kind": "network",
        "audiences": [
          {
            "host": "*",
            "ports": [
              "*"
            ],
            "schemes": [
              "*"
            ],
            "path_prefixes": [
              "/"
            ],
            "methods": [
              "*"
            ]
          }
        ]
      },
      "justification": "No egress permitted"
    },
    {
      "effect_class": "proc.spawn",
      "scope": {
        "kind": "process",
        "commands": [
          "*"
        ]
      },
      "justification": "No child process execution"
    },
    {
      "effect_class": "capability.delegate",
      "scope": {
        "kind": "delegation"
      },
      "justification": "No capability forwarding"
    }
  ],
  "authority_ceiling": [
    {
      "effect_class": "fs.read",
      "scope": {
        "kind": "filesystem",
        "paths": [
          "/workspace/input/**"
        ],
        "symlink_policy": "deny",
        "follow_mounts": false
      },
      "cardinality": {
        "max_calls": 1000,
        "max_bytes": 1073741824
      }
    },
    {
      "effect_class": "fs.list",
      "scope": {
        "kind": "filesystem",
        "paths": [
          "/workspace/input/**"
        ],
        "symlink_policy": "deny",
        "follow_mounts": false
      },
      "cardinality": {
        "max_calls": 100
      }
    },
    {
      "effect_class": "clock.read",
      "scope": {
        "kind": "system"
      },
      "cardinality": {
        "max_calls": 10
      }
    }
  ],
  "required_runtime_guarantees": {
    "execution_isolation_assurance": {
      "minimum": "strong"
    },
    "filesystem_isolation_class": {
      "minimum": "preopen_only"
    },
    "network_policy_granularity": {
      "minimum": "binary"
    },
    "child_process_policy": {
      "required_mode": "forbidden"
    },
    "token_passthrough_policy": {
      "required_mode": "forbidden"
    },
    "revocation_behavior": {
      "required_mode": "expiry_only"
    },
    "delegation_enforcement": {
      "audience_binding_required": true,
      "call_chain_binding_required": true,
      "anti_replay_required": true,
      "max_hops_enforced_required": true
    },
    "witness_support": {
      "minimum_level": "hostcall",
      "acceptable_tamper_evidence_modes": [
        "hash_chain",
        "merkle_chain"
      ],
      "acceptable_signature_modes": [
        "runtime_key",
        "external_signer"
      ],
      "trusted_time_source_required": true,
      "redacted_io_hashes_required": true,
      "authority_plan_digest_required": true
    }
  },
  "delegation_policy": {
    "mode": "forbidden",
    "max_hops": 0,
    "audience_binding_required": true,
    "call_chain_binding_required": true,
    "anti_replay_required": true,
    "ttl_seconds_max": 300
  },
  "witness_level": "hostcall",
  "notes": "Reference read-only portable component contract."
}