{
  "kind": "guild.skill_contract",
  "version": "1.0.0",
  "contract_id": "urn:guild:contract:runtime-emit-evidence-zero:v1",
  "component": {
    "name": "hello-inspect",
    "digest": {
      "algorithm": "sha256",
      "value": "9878310506fa7fc567cdb991b838e82b5e5848a2eec6ad8a8012b78f34290f53"
    },
    "component_model": "wasm-component",
    "component_model_version": "0.2.0",
    "wit_world": "guild-skill-inspect-v1"
  },
  "export": {
    "name": "hello_inspect",
    "interface": "example/hello-inspect",
    "version": "1.0.0"
  },
  "input_class_fingerprint": {
    "kind": "json-schema-hash",
    "canonicalization": "rfc8785-jcs",
    "digest": {
      "algorithm": "sha256",
      "value": "373eaf6dc52e5ff8cf6c7d5f3b4f9c8f4ca9f8c2f4d8f387c79c9f8564e7a8cb"
    }
  },
  "required_effects": [
    {
      "family": "emit-evidence",
      "scope": {
        "kind": "evidence",
        "audiences": [
          "user"
        ],
        "redactions": [
          "none"
        ]
      },
      "cardinality": {
        "max_calls": 1,
        "max_bytes": 65536
      },
      "justification": "The live inspect path emits one bounded user-visible evidence record."
    }
  ],
  "forbidden_effects": [],
  "authority_ceiling": [
    {
      "family": "emit-evidence",
      "scope": {
        "kind": "evidence",
        "audiences": [
          "user"
        ],
        "redactions": [
          "none"
        ]
      },
      "cardinality": {
        "max_calls": 1,
        "max_bytes": 65536
      },
      "justification": "Canonical control-plane ceiling matches the live emit-evidence family directly."
    }
  ],
  "required_runtime_guarantees": {
    "execution_isolation_assurance": {
      "minimum": "strong"
    },
    "filesystem_isolation_class": {
      "minimum": "preopen_only"
    },
    "network_policy_granularity": {
      "minimum": "binary"
    },
    "child_process_policy": {
      "required_mode": "forbidden"
    },
    "token_passthrough_policy": {
      "required_mode": "forbidden"
    },
    "revocation_behavior": {
      "required_mode": "expiry_only"
    },
    "delegation_enforcement": {
      "audience_binding_required": false,
      "call_chain_binding_required": false,
      "anti_replay_required": false,
      "max_hops_enforced_required": false
    },
    "witness_support": {
      "minimum_level": "decision",
      "acceptable_tamper_evidence_modes": [
        "hash_chain",
        "merkle_chain"
      ],
      "acceptable_signature_modes": [
        "runtime_key",
        "external_signer"
      ],
      "trusted_time_source_required": false,
      "redacted_io_hashes_required": false,
      "authority_plan_digest_required": false
    }
  },
  "delegation_policy": {
    "mode": "forbidden",
    "max_hops": 0,
    "audience_binding_required": false,
    "call_chain_binding_required": false,
    "anti_replay_required": false,
    "ttl_seconds_max": 300
  },
  "witness_level": "decision",
  "notes": "Direct canonical emit-evidence example. Draft-v1 carries the live family directly and keeps the bounded M5 limitation explicit."
}
