{
  "kind": "guild.skill_contract",
  "version": "1.0.0",
  "contract_id": "urn:guild:contract:runtime-read-resource:v1",
  "component": {
    "name": "runtime-read-resource-example",
    "digest": {
      "algorithm": "sha256",
      "value": "20cb19c3bbe598472cb6dbe6beee9b03d9e24196511874fb8aa98051354d633c"
    },
    "component_model": "wasm-component",
    "component_model_version": "0.2.0",
    "wit_world": "guild-skill-inspect-v1"
  },
  "export": {
    "name": "read_execution_resource",
    "interface": "example/runtime-read-resource",
    "version": "1.0.0"
  },
  "input_class_fingerprint": {
    "kind": "json-schema-hash",
    "canonicalization": "rfc8785-jcs",
    "digest": {
      "algorithm": "sha256",
      "value": "1632b740d38ce65db5debeae5ec0f5c62c57cf4c6847ee12bf7a5a932845f5d4"
    }
  },
  "required_effects": [
    {
      "family": "read-resource",
      "scope": {
        "kind": "resource",
        "uri_prefixes": [
          "guild://executions/",
          "guild://objects/records/"
        ],
        "resource_kinds": [
          "execution",
          "object"
        ]
      },
      "cardinality": {
        "max_calls": 2,
        "max_bytes": 16384
      },
      "justification": "Read one execution resource and, if present, one companion object record through the live canonical read-resource host surface."
    }
  ],
  "forbidden_effects": [
    {
      "effect_class": "capability.delegate",
      "scope": {
        "kind": "delegation"
      },
      "justification": "No downstream delegation."
    }
  ],
  "authority_ceiling": [
    {
      "family": "read-resource",
      "scope": {
        "kind": "resource",
        "uri_prefixes": [
          "guild://executions/",
          "guild://objects/records/"
        ],
        "resource_kinds": [
          "execution",
          "object"
        ]
      },
      "cardinality": {
        "max_calls": 2,
        "max_bytes": 16384
      },
      "justification": "Canonical control-plane ceiling matches the live read-resource family directly."
    }
  ],
  "required_runtime_guarantees": {
    "execution_isolation_assurance": {
      "minimum": "strong"
    },
    "filesystem_isolation_class": {
      "minimum": "preopen_only"
    },
    "network_policy_granularity": {
      "minimum": "binary"
    },
    "child_process_policy": {
      "required_mode": "forbidden"
    },
    "token_passthrough_policy": {
      "required_mode": "forbidden"
    },
    "revocation_behavior": {
      "required_mode": "lease"
    },
    "delegation_enforcement": {
      "audience_binding_required": true,
      "call_chain_binding_required": true,
      "anti_replay_required": true,
      "max_hops_enforced_required": true
    },
    "witness_support": {
      "minimum_level": "hostcall",
      "acceptable_tamper_evidence_modes": [
        "hash_chain",
        "merkle_chain"
      ],
      "acceptable_signature_modes": [
        "runtime_key",
        "external_signer"
      ],
      "trusted_time_source_required": true,
      "redacted_io_hashes_required": true,
      "authority_plan_digest_required": true
    }
  },
  "delegation_policy": {
    "mode": "forbidden",
    "max_hops": 0,
    "audience_binding_required": true,
    "call_chain_binding_required": true,
    "anti_replay_required": true,
    "ttl_seconds_max": 300
  },
  "witness_level": "hostcall",
  "notes": "Direct canonical read-resource example. Scope roots and resource kinds match the live Rust runner's typed Guild URI authorization model."
}
